{
  "schemaVersion": 1,
  "asOf": "2026-09-08T00:00:00Z",
  "status": "public_audit_complete_verification_gated",
  "purpose": "Establish which Mythical public properties and social accounts can be safely treated as official before any account creation, connection, publication, reply, moderation, measurement, or impersonation response.",
  "authority": {
    "accountCreationAuthorized": false,
    "accountClaimingAuthorized": false,
    "credentialConnectionAuthorized": false,
    "publishingAuthorized": false,
    "schedulingAuthorized": false,
    "replyingAuthorized": false,
    "moderationActionAuthorized": false,
    "analyticsConnectionAuthorized": false,
    "paidPromotionAuthorized": false,
    "impersonationEnforcementAuthorized": false,
    "externalActionAuthorized": false,
    "minorTargetingPermitted": false,
    "conversationIsAuthorization": false
  },
  "publicObservation": {
    "officialDomain": "https://mythicalvoid.com/",
    "homepageHttpStatus": 200,
    "homepageContentType": "text/html; charset=UTF-8",
    "homepageSocialAccountLinkCount": 0,
    "deployedEntryAssetSocialAccountReferenceCount": 0,
    "twitterCardMetadataPresent": true,
    "twitterAccountOwnershipEvidencePresent": false,
    "officialSocialAccountCandidateCount": 0,
    "confirmedOfficialSocialAccountCount": 0,
    "socialIdentityReservationRef": "docs/company/content/channel-launch/SOCIAL_IDENTITY_RESERVATION_2026-09-08.json",
    "preferredHandleCandidate": "PlayMythicalVoid",
    "fallbackHandleCandidate": "MythicalVoidGame",
    "candidateHandleAvailabilityConfirmed": false,
    "exactMythicalVoidHandleCollisionObservedOn": [
      "YouTube",
      "Instagram",
      "TikTok"
    ],
    "unrelatedOrAmbiguousResultsObserved": true,
    "conclusion": "No official Mythical Void social account was confirmed by the sampled public site and exact-name/domain searches. This is evidence of an unresolved inventory, not evidence that no account exists.",
    "methods": [
      "Fetched the live official homepage and its deployed entry asset without authentication.",
      "Checked live HTML and entry asset for outbound YouTube, Instagram, TikTok, LinkedIn, X/Twitter, Discord, Facebook, Bluesky, and Mastodon account references.",
      "Sampled exact-name and official-domain web searches for YouTube, Instagram, LinkedIn, and the current play proposition."
    ],
    "searchSamples": [
      { "query": "\"Mythical Void\" game official YouTube", "confirmedOfficialCandidateUrls": [] },
      { "query": "site:youtube.com \"Mythical Void\" game", "confirmedOfficialCandidateUrls": [] },
      { "query": "site:linkedin.com/company \"Mythical Void\" game", "confirmedOfficialCandidateUrls": [] },
      { "query": "site:instagram.com \"Mythical Void\" game", "confirmedOfficialCandidateUrls": [] },
      { "query": "\"mythicalvoid.com\" YouTube", "confirmedOfficialCandidateUrls": [] },
      { "query": "\"mythicalvoid.com\" Instagram", "confirmedOfficialCandidateUrls": [] },
      { "query": "\"mythicalvoid.com\" LinkedIn", "confirmedOfficialCandidateUrls": [] },
      { "query": "\"Mythical Void\" \"Play free in your browser\"", "confirmedOfficialCandidateUrls": [] }
    ]
  },
  "verificationStandard": {
    "twitterCardMetadataCountsAsAccountProof": false,
    "searchResultNameMatchCountsAsOwnership": false,
    "conversationOrScreenshotCountsAsAuthorization": false,
    "minimumOwnershipEvidence": [
      "Exact canonical account URL",
      "Authenticated owner/admin access observed by a named human",
      "Official-domain reciprocal link or separately recorded identity evidence",
      "Platform handle/display name/description and recovery ownership checked",
      "No material naming collision or impersonation ambiguity unresolved",
      "Credential scope and removal owner recorded outside the shared repository"
    ],
    "accountCreationRequires": [
      "D-011 channel decision",
      "Name/handle collision and trademark review",
      "Named owner and backup",
      "Recovery and multi-factor authentication plan",
      "Platform terms, age, privacy, generated-media, and advertising review",
      "Moderation, safeguarding, incident, and coverage model",
      "Scoped publishing and analytics roles",
      "First complete evidence-led content package",
      "Separate trusted approval"
    ]
  },
  "channels": [
    {
      "channelRef": "CH-001",
      "verificationState": "owned_web_observed_access_known",
      "canonicalProperty": "https://mythicalvoid.com/",
      "candidateAccountUrls": [],
      "ownerConfirmed": false,
      "backupConfirmed": false,
      "recoveryVerified": false,
      "publishingCredentialConnected": false,
      "moderationReady": false,
      "measurementReady": false,
      "publishReady": false,
      "impersonationReviewRequired": false,
      "nextAction": "Complete the coordinated owned-site release and webmaster verification; website access does not authorize social publication."
    },
    {
      "channelRef": "CH-002",
      "verificationState": "no_public_official_account_confirmed",
      "canonicalProperty": null,
      "candidateAccountUrls": [],
      "ownerConfirmed": false,
      "backupConfirmed": false,
      "recoveryVerified": false,
      "publishingCredentialConnected": false,
      "moderationReady": false,
      "measurementReady": false,
      "publishReady": false,
      "impersonationReviewRequired": true,
      "nextAction": "Kevin approves the PlayMythicalVoid handle family, then checks it inside YouTube and confirms ownership, recovery and multi-factor security without sharing credentials."
    },
    {
      "channelRef": "CH-003",
      "verificationState": "no_public_official_account_confirmed",
      "canonicalProperty": null,
      "candidateAccountUrls": [],
      "ownerConfirmed": false,
      "backupConfirmed": false,
      "recoveryVerified": false,
      "publishingCredentialConnected": false,
      "moderationReady": false,
      "measurementReady": false,
      "publishReady": false,
      "impersonationReviewRequired": true,
      "nextAction": "After the YouTube identity decision, Kevin may check PlayMythicalVoid on Instagram and TikTok; reserve nothing without ownership, recovery, multi-factor security and human moderation."
    },
    {
      "channelRef": "CH-004",
      "verificationState": "no_public_official_account_confirmed",
      "canonicalProperty": null,
      "candidateAccountUrls": [],
      "ownerConfirmed": false,
      "backupConfirmed": false,
      "recoveryVerified": false,
      "publishingCredentialConnected": false,
      "moderationReady": false,
      "measurementReady": false,
      "publishReady": false,
      "impersonationReviewRequired": true,
      "nextAction": "Use Kevin's existing founder profile first. If a separate Page is wanted, check play-mythical-void and then mythical-void-game inside LinkedIn before claiming either."
    },
    {
      "channelRef": "CH-005",
      "verificationState": "community_selection_not_account_identity",
      "canonicalProperty": null,
      "candidateAccountUrls": [],
      "ownerConfirmed": false,
      "backupConfirmed": false,
      "recoveryVerified": false,
      "publishingCredentialConnected": false,
      "moderationReady": false,
      "measurementReady": false,
      "publishReady": false,
      "impersonationReviewRequired": false,
      "nextAction": "Choose communities from accepted audience evidence and review each community rule and human participation identity."
    },
    {
      "channelRef": "CH-006",
      "verificationState": "deferred_no_property",
      "canonicalProperty": null,
      "candidateAccountUrls": [],
      "ownerConfirmed": false,
      "backupConfirmed": false,
      "recoveryVerified": false,
      "publishingCredentialConnected": false,
      "moderationReady": false,
      "measurementReady": false,
      "publishReady": false,
      "impersonationReviewRequired": false,
      "nextAction": "Remain deferred until safeguarding, age, moderation, incident, bot, identity, and data controls exist."
    },
    {
      "channelRef": "CH-007",
      "verificationState": "deferred_no_property",
      "canonicalProperty": null,
      "candidateAccountUrls": [],
      "ownerConfirmed": false,
      "backupConfirmed": false,
      "recoveryVerified": false,
      "publishingCredentialConnected": false,
      "moderationReady": false,
      "measurementReady": false,
      "publishReady": false,
      "impersonationReviewRequired": false,
      "nextAction": "Remain deferred until adult consent, sender identity, suppression, rights, retention, security, value, and frequency controls exist."
    }
  ],
  "publishingPreflight": {
    "firstCandidateContentRef": "CQ-006",
    "firstCandidateChannelRef": "CH-001",
    "candidatePackageRef": "docs/company/content/drafts/PROJECT_BEACON_INTRO.json",
    "atomizedCampaignPackageRef": "docs/company/content/campaigns/project-beacon-foundation.json",
    "requiredGates": {
      "channelDecisionRecorded": false,
      "canonicalIdentityVerified": false,
      "ownerAndBackupConfirmed": false,
      "recoveryAndMfaVerified": false,
      "credentialScopeApproved": false,
      "moderationAndSafeguardingReady": false,
      "measurementAndPrivacyReady": false,
      "claimsAndProofAccepted": false,
      "accessibilityReady": false,
      "generatedMediaAndDisclosureReviewed": false,
      "completePreviewApproved": false,
      "trustedApprovalRecorded": false,
      "publisherAndKillSwitchTested": false,
      "replyAndIncidentCoverageActive": false,
      "postPublicationReconciliationReady": false
    },
    "publicationReady": false
  },
  "accountInventoryDecisionReady": true,
  "impersonationMonitoringReady": false,
  "publishingReady": false
}
